{
  "$schema": "http://json-schema.org/draft-07/schema#",
  "$id": "brief.schema.json",
  "type": "object",
  "required": ["title", "description"],
  "properties": {
    "title": {
      "type": "string",
      "description": "The project or trailer title."
    },
    "description": {
      "type": "string",
      "description": "A creative brief describing the trailer goals, tone, and asset requirements."
    },
    "duration_seconds": {
      "type": "number",
      "description": "Target trailer duration in seconds.",
      "minimum": 5,
      "maximum": 300
    },
    "scenes": {
      "type": "array",
      "items": {
        "type": "object",
        "required": ["name", "element"],
        "properties": {
          "name": { "type": "string" },
          "element": { "type": "string" },
          "props": { "type": "object" }
        }
      }
    }
  }
}
