{
  "$schema": "../../schemas/brief.schema.json",
  "title": "Summer Blockbuster Trailer",
  "description": "Create a high-energy 60-second teaser for a summer action film. Use dramatic title cards, fast cuts between action shots, and a pulsing soundtrack. Target audience: 18-35 action movie fans.",
  "duration_seconds": 60,
  "scenes": [
    {
      "name": "opening",
      "element": "project-title-card",
      "props": { "title": "SUMMER STORM" }
    },
    {
      "name": "action_montage",
      "element": "project-title-card",
      "props": { "title": "COMING SOON" }
    }
  ]
}
